{
  "$schema": "https://raw.githubusercontent.com/dst0/p/main/packages/coding-agent/src/modes/interactive/theme/theme-schema.json",
  "name": "thanksgiving",
  "symbol": "🍂",
  "vars": {
    "rust": "#bf360c",
    "deepRust": "#7f2000",
    "burgundy": "#880e4f",
    "golden": "#f9a825",
    "amber": "#ff8f00",
    "brown": "#5d4037",
    "cream": "#efe0cf",
    "text": "#e8dcc8",
    "gray": "#8a7a6a",
    "dimGray": "#5a4a3a",
    "darkGray": "#2a1e15",
    "selectedBg": "#2a1a10",
    "userMsgBg": "#201510",
    "toolPendingBg": "#1e1510",
    "toolSuccessBg": "#1e1a10",
    "toolErrorBg": "#301510",
    "customMsgBg": "#201518"
  },
  "colors": {
    "accent": "amber",
    "border": "brown",
    "borderAccent": "golden",
    "borderMuted": "darkGray",
    "success": "golden",
    "error": "rust",
    "warning": "amber",
    "muted": "gray",
    "dim": "dimGray",
    "text": "text",
    "thinkingText": "gray",

    "selectedBg": "selectedBg",
    "userMessageBg": "userMsgBg",
    "userMessageText": "text",
    "customMessageBg": "customMsgBg",
    "customMessageText": "text",
    "customMessageLabel": "burgundy",
    "toolPendingBg": "toolPendingBg",
    "toolSuccessBg": "toolSuccessBg",
    "toolErrorBg": "toolErrorBg",
    "toolTitle": "text",
    "toolOutput": "gray",

    "mdHeading": "golden",
    "mdLink": "amber",
    "mdLinkUrl": "dimGray",
    "mdCode": "rust",
    "mdCodeBlock": "burgundy",
    "mdCodeBlockBorder": "gray",
    "mdQuote": "gray",
    "mdQuoteBorder": "brown",
    "mdHr": "dimGray",
    "mdListBullet": "golden",

    "toolDiffAdded": "golden",
    "toolDiffRemoved": "rust",
    "toolDiffContext": "gray",

    "syntaxComment": "#4a4030",
    "syntaxKeyword": "#880e4f",
    "syntaxFunction": "#f9a825",
    "syntaxVariable": "#ff8f00",
    "syntaxString": "#bf360c",
    "syntaxNumber": "#f9a825",
    "syntaxType": "#d4a76a",
    "syntaxOperator": "#e8dcc8",
    "syntaxPunctuation": "#8a7a6a",

    "thinkingOff": "darkGray",
    "thinkingMinimal": "#5a4a3a",
    "thinkingLow": "#f9a825",
    "thinkingMedium": "#ff8f00",
    "thinkingHigh": "#bf360c",
    "thinkingXhigh": "#7f2000",

    "bashMode": "amber"
  },
  "export": {
    "pageBg": "#0e0a08",
    "cardBg": "#15100e",
    "infoBg": "#1a1510"
  }
}
