{
  "$schema": "https://raw.githubusercontent.com/dst0/p/main/packages/coding-agent/src/modes/interactive/theme/theme-schema.json",
  "name": "sakura",
  "vars": {
    "background": "#fff5f7",
    "foreground": "#4a3b42",
    "selection": "#f7d6df",
    "comment": "#9c828d",
    "pink": "#e05688",
    "deepPink": "#c2396d",
    "green": "#2b9077",
    "yellow": "#d98a2b",
    "purple": "#855294",
    "teal": "#339999",
    "red": "#d9435e",
    "toolPendingBg": "#fcf0f4",
    "toolSuccessBg": "#eef8f5",
    "toolErrorBg": "#fceef0",
    "userMsgBg": "#faebf0",
    "customMsgBg": "#f6eaf8"
  },
  "colors": {
    "accent": "pink",
    "border": "#f0c4d0",
    "borderAccent": "deepPink",
    "borderMuted": "#f7d6df",
    "success": "green",
    "error": "red",
    "warning": "yellow",
    "muted": "comment",
    "dim": "#b89da8",
    "text": "foreground",
    "thinkingText": "comment",

    "selectedBg": "selection",
    "userMessageBg": "userMsgBg",
    "userMessageText": "foreground",
    "customMessageBg": "customMsgBg",
    "customMessageText": "foreground",
    "customMessageLabel": "purple",
    "toolPendingBg": "toolPendingBg",
    "toolSuccessBg": "toolSuccessBg",
    "toolErrorBg": "toolErrorBg",
    "toolTitle": "foreground",
    "toolOutput": "comment",

    "mdHeading": "deepPink",
    "mdLink": "pink",
    "mdLinkUrl": "comment",
    "mdCode": "teal",
    "mdCodeBlock": "green",
    "mdCodeBlockBorder": "#f0c4d0",
    "mdQuote": "comment",
    "mdQuoteBorder": "pink",
    "mdHr": "#f0c4d0",
    "mdListBullet": "pink",

    "toolDiffAdded": "green",
    "toolDiffRemoved": "red",
    "toolDiffContext": "comment",

    "syntaxComment": "comment",
    "syntaxKeyword": "deepPink",
    "syntaxFunction": "purple",
    "syntaxVariable": "foreground",
    "syntaxString": "green",
    "syntaxNumber": "yellow",
    "syntaxType": "teal",
    "syntaxOperator": "deepPink",
    "syntaxPunctuation": "foreground",

    "thinkingOff": "#f0c4d0",
    "thinkingMinimal": "comment",
    "thinkingLow": "teal",
    "thinkingMedium": "pink",
    "thinkingHigh": "purple",
    "thinkingXhigh": "red",

    "bashMode": "green"
  },
  "export": {
    "pageBg": "#f7e8ec",
    "cardBg": "#fff5f7",
    "infoBg": "#faebf0"
  }
}
