{
  "$schema": "https://raw.githubusercontent.com/dst0/p/main/packages/coding-agent/src/modes/interactive/theme/theme-schema.json",
  "name": "one-light",
  "vars": {
    "background": "#fafafa",
    "foreground": "#383a42",
    "selection": "#e5e5e6",
    "comment": "#a0a1a7",
    "blue": "#4078f2",
    "cyan": "#0184bc",
    "green": "#50a14f",
    "purple": "#a626a4",
    "red": "#e45649",
    "yellow": "#c18401",
    "orange": "#986801",
    "toolPendingBg": "#f0f4fc",
    "toolSuccessBg": "#eff7ee",
    "toolErrorBg": "#fcf0f0",
    "userMsgBg": "#f0f0f1",
    "customMsgBg": "#f7f0fc"
  },
  "colors": {
    "accent": "blue",
    "border": "#e5e5e6",
    "borderAccent": "cyan",
    "borderMuted": "#f0f0f1",
    "success": "green",
    "error": "red",
    "warning": "yellow",
    "muted": "comment",
    "dim": "#a0a1a7",
    "text": "foreground",
    "thinkingText": "comment",

    "selectedBg": "selection",
    "userMessageBg": "userMsgBg",
    "userMessageText": "foreground",
    "customMessageBg": "customMsgBg",
    "customMessageText": "foreground",
    "customMessageLabel": "purple",
    "toolPendingBg": "toolPendingBg",
    "toolSuccessBg": "toolSuccessBg",
    "toolErrorBg": "toolErrorBg",
    "toolTitle": "foreground",
    "toolOutput": "comment",

    "mdHeading": "yellow",
    "mdLink": "blue",
    "mdLinkUrl": "comment",
    "mdCode": "cyan",
    "mdCodeBlock": "green",
    "mdCodeBlockBorder": "#e5e5e6",
    "mdQuote": "comment",
    "mdQuoteBorder": "blue",
    "mdHr": "#e5e5e6",
    "mdListBullet": "blue",

    "toolDiffAdded": "green",
    "toolDiffRemoved": "red",
    "toolDiffContext": "comment",

    "syntaxComment": "comment",
    "syntaxKeyword": "purple",
    "syntaxFunction": "blue",
    "syntaxVariable": "red",
    "syntaxString": "green",
    "syntaxNumber": "orange",
    "syntaxType": "yellow",
    "syntaxOperator": "cyan",
    "syntaxPunctuation": "foreground",

    "thinkingOff": "#e5e5e6",
    "thinkingMinimal": "comment",
    "thinkingLow": "blue",
    "thinkingMedium": "cyan",
    "thinkingHigh": "purple",
    "thinkingXhigh": "red",

    "bashMode": "green"
  },
  "export": {
    "pageBg": "#f0f0f1",
    "cardBg": "#fafafa",
    "infoBg": "#f0f4fc"
  }
}
