{
  "$schema": "https://raw.githubusercontent.com/dst0/p/main/packages/coding-agent/src/modes/interactive/theme/theme-schema.json",
  "name": "lunarnewyear",
  "symbol": "🧧",
  "vars": {
    "red": "#c62828",
    "brightRed": "#ef5350",
    "deepRed": "#b71c1c",
    "gold": "#f9a825",
    "brightGold": "#fdd835",
    "deepGold": "#f57f17",
    "black": "#212121",
    "darkRed": "#3e0000",
    "text": "#fafafa",
    "gray": "#bdbdbd",
    "dimGray": "#9e9e9e",
    "selectedBg": "#1a0505",
    "userMsgBg": "#120404",
    "toolPendingBg": "#15050a",
    "toolSuccessBg": "#150a05",
    "toolErrorBg": "#2a0a0a",
    "customMsgBg": "#1a0510"
  },
  "colors": {
    "accent": "brightRed",
    "border": "deepRed",
    "borderAccent": "gold",
    "borderMuted": "darkRed",
    "success": "brightGold",
    "error": "#ff8a80",
    "warning": "brightGold",
    "muted": "gray",
    "dim": "dimGray",
    "text": "text",
    "thinkingText": "gray",

    "selectedBg": "selectedBg",
    "userMessageBg": "userMsgBg",
    "userMessageText": "text",
    "customMessageBg": "customMsgBg",
    "customMessageText": "text",
    "customMessageLabel": "deepRed",
    "toolPendingBg": "toolPendingBg",
    "toolSuccessBg": "toolSuccessBg",
    "toolErrorBg": "toolErrorBg",
    "toolTitle": "text",
    "toolOutput": "gray",

    "mdHeading": "brightGold",
    "mdLink": "brightRed",
    "mdLinkUrl": "dimGray",
    "mdCode": "red",
    "mdCodeBlock": "deepRed",
    "mdCodeBlockBorder": "gold",
    "mdQuote": "gray",
    "mdQuoteBorder": "brightRed",
    "mdHr": "dimGray",
    "mdListBullet": "brightRed",

    "toolDiffAdded": "brightGold",
    "toolDiffRemoved": "#ff8a80",
    "toolDiffContext": "gray",

    "syntaxComment": "#3e2723",
    "syntaxKeyword": "#c62828",
    "syntaxFunction": "#fdd835",
    "syntaxVariable": "#bdbdbd",
    "syntaxString": "#ef5350",
    "syntaxNumber": "#f9a825",
    "syntaxType": "#d32f2f",
    "syntaxOperator": "#fafafa",
    "syntaxPunctuation": "#9e9e9e",

    "thinkingOff": "darkRed",
    "thinkingMinimal": "#4e342e",
    "thinkingLow": "#bdbdbd",
    "thinkingMedium": "#f9a825",
    "thinkingHigh": "#ef5350",
    "thinkingXhigh": "#c62828",

    "bashMode": "brightRed"
  },
  "export": {
    "pageBg": "#0a0000",
    "cardBg": "#120404",
    "infoBg": "#15050a"
  }
}
