{
  "$schema": "https://raw.githubusercontent.com/dst0/p/main/packages/coding-agent/src/modes/interactive/theme/theme-schema.json",
  "name": "darcula",
  "vars": {
    "background": "#2b2b2b",
    "foreground": "#a9b7c6",
    "selection": "#214283",
    "comment": "#808080",
    "orange": "#cc7832",
    "yellow": "#bbb529",
    "green": "#6a8759",
    "blue": "#6897bb",
    "purple": "#9876aa",
    "cyan": "#288b9e",
    "red": "#ff6b68",
    "toolPendingBg": "#303030",
    "toolSuccessBg": "#273627",
    "toolErrorBg": "#3c2929",
    "userMsgBg": "#3c3f41",
    "customMsgBg": "#393040"
  },
  "colors": {
    "accent": "purple",
    "border": "#4e5254",
    "borderAccent": "orange",
    "borderMuted": "#323232",
    "success": "green",
    "error": "red",
    "warning": "yellow",
    "muted": "comment",
    "dim": "#606060",
    "text": "foreground",
    "thinkingText": "comment",

    "selectedBg": "selection",
    "userMessageBg": "userMsgBg",
    "userMessageText": "foreground",
    "customMessageBg": "customMsgBg",
    "customMessageText": "foreground",
    "customMessageLabel": "purple",
    "toolPendingBg": "toolPendingBg",
    "toolSuccessBg": "toolSuccessBg",
    "toolErrorBg": "toolErrorBg",
    "toolTitle": "foreground",
    "toolOutput": "comment",

    "mdHeading": "orange",
    "mdLink": "blue",
    "mdLinkUrl": "comment",
    "mdCode": "cyan",
    "mdCodeBlock": "green",
    "mdCodeBlockBorder": "#4e5254",
    "mdQuote": "comment",
    "mdQuoteBorder": "orange",
    "mdHr": "#4e5254",
    "mdListBullet": "orange",

    "toolDiffAdded": "green",
    "toolDiffRemoved": "red",
    "toolDiffContext": "comment",

    "syntaxComment": "comment",
    "syntaxKeyword": "orange",
    "syntaxFunction": "yellow",
    "syntaxVariable": "purple",
    "syntaxString": "green",
    "syntaxNumber": "blue",
    "syntaxType": "foreground",
    "syntaxOperator": "orange",
    "syntaxPunctuation": "foreground",

    "thinkingOff": "#323232",
    "thinkingMinimal": "comment",
    "thinkingLow": "blue",
    "thinkingMedium": "cyan",
    "thinkingHigh": "purple",
    "thinkingXhigh": "red",

    "bashMode": "green"
  },
  "export": {
    "pageBg": "#1e1e1e",
    "cardBg": "#2b2b2b",
    "infoBg": "#3c3f41"
  }
}
