{
  "$schema": "https://raw.githubusercontent.com/dst0/p/main/packages/coding-agent/src/modes/interactive/theme/theme-schema.json",
  "name": "solstice",
  "symbol": "❄️",
  "vars": {
    "iceBlue": "#81d4fa",
    "brightIce": "#b3e5fc",
    "deepIce": "#0288d1",
    "frost": "#e1f5fe",
    "silver": "#b0bec5",
    "auroraGreen": "#69f0ae",
    "auroraPurple": "#d1c4e9",
    "pineGreen": "#2e7d32",
    "text": "#e3f2fd",
    "gray": "#90a4ae",
    "dimGray": "#546e7a",
    "darkGray": "#1a237e",
    "selectedBg": "#0a0a15",
    "userMsgBg": "#080815",
    "toolPendingBg": "#0a0a18",
    "toolSuccessBg": "#0a150a",
    "toolErrorBg": "#2a0a0a",
    "customMsgBg": "#0a0a1a"
  },
  "colors": {
    "accent": "iceBlue",
    "border": "deepIce",
    "borderAccent": "auroraGreen",
    "borderMuted": "darkGray",
    "success": "auroraGreen",
    "error": "#c62828",
    "warning": "silver",
    "muted": "gray",
    "dim": "dimGray",
    "text": "text",
    "thinkingText": "gray",

    "selectedBg": "selectedBg",
    "userMessageBg": "userMsgBg",
    "userMessageText": "text",
    "customMessageBg": "customMsgBg",
    "customMessageText": "text",
    "customMessageLabel": "deepIce",
    "toolPendingBg": "toolPendingBg",
    "toolSuccessBg": "toolSuccessBg",
    "toolErrorBg": "toolErrorBg",
    "toolTitle": "text",
    "toolOutput": "gray",

    "mdHeading": "brightIce",
    "mdLink": "auroraGreen",
    "mdLinkUrl": "dimGray",
    "mdCode": "iceBlue",
    "mdCodeBlock": "deepIce",
    "mdCodeBlockBorder": "silver",
    "mdQuote": "gray",
    "mdQuoteBorder": "auroraPurple",
    "mdHr": "dimGray",
    "mdListBullet": "auroraGreen",

    "toolDiffAdded": "auroraGreen",
    "toolDiffRemoved": "#c62828",
    "toolDiffContext": "gray",

    "syntaxComment": "#1a237e",
    "syntaxKeyword": "#0288d1",
    "syntaxFunction": "#69f0ae",
    "syntaxVariable": "#90a4ae",
    "syntaxString": "#81d4fa",
    "syntaxNumber": "#b0bec5",
    "syntaxType": "#d1c4e9",
    "syntaxOperator": "#e3f2fd",
    "syntaxPunctuation": "#546e7a",

    "thinkingOff": "darkGray",
    "thinkingMinimal": "#283593",
    "thinkingLow": "#90a4ae",
    "thinkingMedium": "#81d4fa",
    "thinkingHigh": "#69f0ae",
    "thinkingXhigh": "#0288d1",

    "bashMode": "iceBlue"
  },
  "export": {
    "pageBg": "#05050a",
    "cardBg": "#080815",
    "infoBg": "#0a0a15"
  }
}
