{
  "$schema": "https://raw.githubusercontent.com/dst0/p/main/packages/coding-agent/src/modes/interactive/theme/theme-schema.json",
  "name": "christmas",
  "symbol": "🎄",
  "vars": {
    "red": "#c62828",
    "deepRed": "#8e0000",
    "green": "#2e7d32",
    "deepGreen": "#1b5e20",
    "gold": "#f9a825",
    "brightGold": "#fdd835",
    "snow": "#f5f5f5",
    "text": "#e0e0e0",
    "gray": "#8a8a8a",
    "dimGray": "#5a5a5a",
    "darkGray": "#2a2a2a",
    "selectedBg": "#2a1515",
    "userMsgBg": "#1a1015",
    "toolPendingBg": "#151520",
    "toolSuccessBg": "#152015",
    "toolErrorBg": "#301010",
    "customMsgBg": "#1a1520"
  },
  "colors": {
    "accent": "red",
    "border": "deepGreen",
    "borderAccent": "gold",
    "borderMuted": "darkGray",
    "success": "green",
    "error": "red",
    "warning": "gold",
    "muted": "gray",
    "dim": "dimGray",
    "text": "text",
    "thinkingText": "gray",

    "selectedBg": "selectedBg",
    "userMessageBg": "userMsgBg",
    "userMessageText": "text",
    "customMessageBg": "customMsgBg",
    "customMessageText": "text",
    "customMessageLabel": "deepRed",
    "toolPendingBg": "toolPendingBg",
    "toolSuccessBg": "toolSuccessBg",
    "toolErrorBg": "toolErrorBg",
    "toolTitle": "text",
    "toolOutput": "gray",

    "mdHeading": "gold",
    "mdLink": "red",
    "mdLinkUrl": "dimGray",
    "mdCode": "green",
    "mdCodeBlock": "deepGreen",
    "mdCodeBlockBorder": "gray",
    "mdQuote": "gray",
    "mdQuoteBorder": "deepRed",
    "mdHr": "dimGray",
    "mdListBullet": "gold",

    "toolDiffAdded": "green",
    "toolDiffRemoved": "red",
    "toolDiffContext": "gray",

    "syntaxComment": "#4a5a4a",
    "syntaxKeyword": "#c62828",
    "syntaxFunction": "#f9a825",
    "syntaxVariable": "#fdd835",
    "syntaxString": "#4caf50",
    "syntaxNumber": "#fdd835",
    "syntaxType": "#81c784",
    "syntaxOperator": "#e0e0e0",
    "syntaxPunctuation": "#8a8a8a",

    "thinkingOff": "darkGray",
    "thinkingMinimal": "#5a5a5a",
    "thinkingLow": "#2e7d32",
    "thinkingMedium": "#c62828",
    "thinkingHigh": "#f9a825",
    "thinkingXhigh": "#8e0000",

    "bashMode": "red"
  },
  "export": {
    "pageBg": "#0e0a0a",
    "cardBg": "#151010",
    "infoBg": "#1a1510"
  }
}
