{
  "$schema": "https://raw.githubusercontent.com/dst0/p/main/packages/coding-agent/src/modes/interactive/theme/theme-schema.json",
  "name": "valentine",
  "symbol": "❤️",
  "vars": {
    "red": "#c62828",
    "deepRed": "#8e0000",
    "rose": "#e91e63",
    "pink": "#f48fb1",
    "lightPink": "#fce4ec",
    "coral": "#ff6f61",
    "text": "#f8e8ee",
    "gray": "#8a6a7a",
    "dimGray": "#5a3a4a",
    "darkGray": "#2a1520",
    "selectedBg": "#2a1020",
    "userMsgBg": "#201015",
    "toolPendingBg": "#1e1020",
    "toolSuccessBg": "#1e1520",
    "toolErrorBg": "#301015",
    "customMsgBg": "#201025"
  },
  "colors": {
    "accent": "rose",
    "border": "deepRed",
    "borderAccent": "coral",
    "borderMuted": "darkGray",
    "success": "pink",
    "error": "red",
    "warning": "coral",
    "muted": "gray",
    "dim": "dimGray",
    "text": "text",
    "thinkingText": "gray",

    "selectedBg": "selectedBg",
    "userMessageBg": "userMsgBg",
    "userMessageText": "text",
    "customMessageBg": "customMsgBg",
    "customMessageText": "text",
    "customMessageLabel": "rose",
    "toolPendingBg": "toolPendingBg",
    "toolSuccessBg": "toolSuccessBg",
    "toolErrorBg": "toolErrorBg",
    "toolTitle": "text",
    "toolOutput": "gray",

    "mdHeading": "rose",
    "mdLink": "coral",
    "mdLinkUrl": "dimGray",
    "mdCode": "pink",
    "mdCodeBlock": "deepRed",
    "mdCodeBlockBorder": "gray",
    "mdQuote": "gray",
    "mdQuoteBorder": "red",
    "mdHr": "dimGray",
    "mdListBullet": "coral",

    "toolDiffAdded": "pink",
    "toolDiffRemoved": "red",
    "toolDiffContext": "gray",

    "syntaxComment": "#4a3040",
    "syntaxKeyword": "#e91e63",
    "syntaxFunction": "#ff6f61",
    "syntaxVariable": "#f48fb1",
    "syntaxString": "#c62828",
    "syntaxNumber": "#ff6f61",
    "syntaxType": "#f8bbd0",
    "syntaxOperator": "#f8e8ee",
    "syntaxPunctuation": "#8a6a7a",

    "thinkingOff": "darkGray",
    "thinkingMinimal": "#5a3040",
    "thinkingLow": "#f48fb1",
    "thinkingMedium": "#e91e63",
    "thinkingHigh": "#ff6f61",
    "thinkingXhigh": "#c62828",

    "bashMode": "rose"
  },
  "export": {
    "pageBg": "#15080c",
    "cardBg": "#1a0e12",
    "infoBg": "#201018"
  }
}
