{
  "$schema": "https://raw.githubusercontent.com/dst0/p/main/packages/coding-agent/src/modes/interactive/theme/theme-schema.json",
  "name": "solarized-dark",
  "vars": {
    "base03": "#002b36",
    "base02": "#073642",
    "base01": "#586e75",
    "base00": "#657b83",
    "base0": "#839496",
    "base1": "#93a1a1",
    "base2": "#eee8d5",
    "base3": "#fdf6e3",
    "yellow": "#b58900",
    "orange": "#cb4b16",
    "red": "#dc322f",
    "magenta": "#d33682",
    "violet": "#6c71c4",
    "blue": "#268bd2",
    "cyan": "#2aa198",
    "green": "#859900",
    "toolPendingBg": "#09333e",
    "toolSuccessBg": "#0d3936",
    "toolErrorBg": "#202d36",
    "userMsgBg": "#073642",
    "customMsgBg": "#113243"
  },
  "colors": {
    "accent": "cyan",
    "border": "base01",
    "borderAccent": "blue",
    "borderMuted": "base02",
    "success": "green",
    "error": "red",
    "warning": "yellow",
    "muted": "base01",
    "dim": "base00",
    "text": "base0",
    "thinkingText": "base01",

    "selectedBg": "base02",
    "userMessageBg": "userMsgBg",
    "userMessageText": "base1",
    "customMessageBg": "customMsgBg",
    "customMessageText": "base1",
    "customMessageLabel": "violet",
    "toolPendingBg": "toolPendingBg",
    "toolSuccessBg": "toolSuccessBg",
    "toolErrorBg": "toolErrorBg",
    "toolTitle": "base0",
    "toolOutput": "base01",

    "mdHeading": "yellow",
    "mdLink": "blue",
    "mdLinkUrl": "base01",
    "mdCode": "cyan",
    "mdCodeBlock": "green",
    "mdCodeBlockBorder": "base01",
    "mdQuote": "base01",
    "mdQuoteBorder": "blue",
    "mdHr": "base01",
    "mdListBullet": "cyan",

    "toolDiffAdded": "green",
    "toolDiffRemoved": "red",
    "toolDiffContext": "base01",

    "syntaxComment": "base01",
    "syntaxKeyword": "green",
    "syntaxFunction": "blue",
    "syntaxVariable": "cyan",
    "syntaxString": "cyan",
    "syntaxNumber": "magenta",
    "syntaxType": "yellow",
    "syntaxOperator": "green",
    "syntaxPunctuation": "base0",

    "thinkingOff": "base02",
    "thinkingMinimal": "base01",
    "thinkingLow": "blue",
    "thinkingMedium": "cyan",
    "thinkingHigh": "violet",
    "thinkingXhigh": "magenta",

    "bashMode": "green"
  },
  "export": {
    "pageBg": "#001e26",
    "cardBg": "#002b36",
    "infoBg": "#073642"
  }
}
