{
  "$schema": "https://raw.githubusercontent.com/dst0/p/main/packages/coding-agent/src/modes/interactive/theme/theme-schema.json",
  "name": "monokai",
  "vars": {
    "background": "#272822",
    "foreground": "#f8f8f2",
    "selection": "#49483e",
    "comment": "#75715e",
    "green": "#a6e22e",
    "pink": "#f92672",
    "cyan": "#66d9ef",
    "orange": "#fd971f",
    "purple": "#ae81ff",
    "yellow": "#e6db74",
    "toolPendingBg": "#2d2e27",
    "toolSuccessBg": "#293422",
    "toolErrorBg": "#3d2228",
    "userMsgBg": "#3e3d32",
    "customMsgBg": "#362e3d"
  },
  "colors": {
    "accent": "pink",
    "border": "comment",
    "borderAccent": "cyan",
    "borderMuted": "selection",
    "success": "green",
    "error": "pink",
    "warning": "orange",
    "muted": "comment",
    "dim": "#595543",
    "text": "foreground",
    "thinkingText": "comment",

    "selectedBg": "selection",
    "userMessageBg": "userMsgBg",
    "userMessageText": "foreground",
    "customMessageBg": "customMsgBg",
    "customMessageText": "foreground",
    "customMessageLabel": "purple",
    "toolPendingBg": "toolPendingBg",
    "toolSuccessBg": "toolSuccessBg",
    "toolErrorBg": "toolErrorBg",
    "toolTitle": "foreground",
    "toolOutput": "comment",

    "mdHeading": "orange",
    "mdLink": "cyan",
    "mdLinkUrl": "comment",
    "mdCode": "green",
    "mdCodeBlock": "yellow",
    "mdCodeBlockBorder": "comment",
    "mdQuote": "comment",
    "mdQuoteBorder": "pink",
    "mdHr": "comment",
    "mdListBullet": "cyan",

    "toolDiffAdded": "green",
    "toolDiffRemoved": "pink",
    "toolDiffContext": "comment",

    "syntaxComment": "comment",
    "syntaxKeyword": "pink",
    "syntaxFunction": "green",
    "syntaxVariable": "orange",
    "syntaxString": "yellow",
    "syntaxNumber": "purple",
    "syntaxType": "cyan",
    "syntaxOperator": "pink",
    "syntaxPunctuation": "foreground",

    "thinkingOff": "selection",
    "thinkingMinimal": "comment",
    "thinkingLow": "cyan",
    "thinkingMedium": "green",
    "thinkingHigh": "orange",
    "thinkingXhigh": "pink",

    "bashMode": "green"
  },
  "export": {
    "pageBg": "#1e1f1c",
    "cardBg": "#272822",
    "infoBg": "#3e3d32"
  }
}
