{
  "$schema": "https://raw.githubusercontent.com/dst0/p/main/packages/coding-agent/src/modes/interactive/theme/theme-schema.json",
  "name": "tokyo-night",
  "vars": {
    "background": "#1a1b26",
    "foreground": "#a9b1d6",
    "selection": "#28345a",
    "comment": "#565f89",
    "blue": "#7aa2f7",
    "cyan": "#7dcfff",
    "green": "#9ece6a",
    "magenta": "#bb9af7",
    "red": "#f7768e",
    "orange": "#ff9e64",
    "yellow": "#e0af68",
    "teal": "#1abc9c",
    "toolPendingBg": "#202336",
    "toolSuccessBg": "#222c36",
    "toolErrorBg": "#362230",
    "userMsgBg": "#24283b",
    "customMsgBg": "#2f2442"
  },
  "colors": {
    "accent": "blue",
    "border": "comment",
    "borderAccent": "cyan",
    "borderMuted": "#292e42",
    "success": "green",
    "error": "red",
    "warning": "yellow",
    "muted": "comment",
    "dim": "#414868",
    "text": "foreground",
    "thinkingText": "comment",

    "selectedBg": "selection",
    "userMessageBg": "userMsgBg",
    "userMessageText": "foreground",
    "customMessageBg": "customMsgBg",
    "customMessageText": "foreground",
    "customMessageLabel": "magenta",
    "toolPendingBg": "toolPendingBg",
    "toolSuccessBg": "toolSuccessBg",
    "toolErrorBg": "toolErrorBg",
    "toolTitle": "foreground",
    "toolOutput": "comment",

    "mdHeading": "blue",
    "mdLink": "cyan",
    "mdLinkUrl": "comment",
    "mdCode": "green",
    "mdCodeBlock": "yellow",
    "mdCodeBlockBorder": "comment",
    "mdQuote": "comment",
    "mdQuoteBorder": "blue",
    "mdHr": "comment",
    "mdListBullet": "blue",

    "toolDiffAdded": "green",
    "toolDiffRemoved": "red",
    "toolDiffContext": "comment",

    "syntaxComment": "comment",
    "syntaxKeyword": "magenta",
    "syntaxFunction": "blue",
    "syntaxVariable": "foreground",
    "syntaxString": "green",
    "syntaxNumber": "orange",
    "syntaxType": "cyan",
    "syntaxOperator": "cyan",
    "syntaxPunctuation": "foreground",

    "thinkingOff": "selection",
    "thinkingMinimal": "comment",
    "thinkingLow": "blue",
    "thinkingMedium": "cyan",
    "thinkingHigh": "magenta",
    "thinkingXhigh": "red",

    "bashMode": "green"
  },
  "export": {
    "pageBg": "#16161e",
    "cardBg": "#1a1b26",
    "infoBg": "#24283b"
  }
}
