{
  "$schema": "https://raw.githubusercontent.com/dst0/p/main/packages/coding-agent/src/modes/interactive/theme/theme-schema.json",
  "name": "catppuccin",
  "vars": {
    "base": "#1e1e2e",
    "mantle": "#181825",
    "crust": "#11111b",
    "text": "#cdd6f4",
    "subtext0": "#a6adc8",
    "overlay0": "#6c7086",
    "surface0": "#313244",
    "surface1": "#45475a",
    "blue": "#89b4fa",
    "teal": "#94e2d5",
    "green": "#a6e3a1",
    "yellow": "#f9e2af",
    "peach": "#fab387",
    "red": "#f38ba8",
    "mauve": "#cba6f7",
    "pink": "#f5c2e7",
    "toolPendingBg": "#262639",
    "toolSuccessBg": "#263234",
    "toolErrorBg": "#362634",
    "userMsgBg": "#313244",
    "customMsgBg": "#382d47"
  },
  "colors": {
    "accent": "blue",
    "border": "overlay0",
    "borderAccent": "teal",
    "borderMuted": "surface0",
    "success": "green",
    "error": "red",
    "warning": "yellow",
    "muted": "overlay0",
    "dim": "subtext0",
    "text": "text",
    "thinkingText": "overlay0",

    "selectedBg": "surface1",
    "userMessageBg": "userMsgBg",
    "userMessageText": "text",
    "customMessageBg": "customMsgBg",
    "customMessageText": "text",
    "customMessageLabel": "mauve",
    "toolPendingBg": "toolPendingBg",
    "toolSuccessBg": "toolSuccessBg",
    "toolErrorBg": "toolErrorBg",
    "toolTitle": "text",
    "toolOutput": "overlay0",

    "mdHeading": "mauve",
    "mdLink": "blue",
    "mdLinkUrl": "overlay0",
    "mdCode": "teal",
    "mdCodeBlock": "green",
    "mdCodeBlockBorder": "overlay0",
    "mdQuote": "overlay0",
    "mdQuoteBorder": "blue",
    "mdHr": "overlay0",
    "mdListBullet": "blue",

    "toolDiffAdded": "green",
    "toolDiffRemoved": "red",
    "toolDiffContext": "overlay0",

    "syntaxComment": "overlay0",
    "syntaxKeyword": "mauve",
    "syntaxFunction": "blue",
    "syntaxVariable": "text",
    "syntaxString": "green",
    "syntaxNumber": "peach",
    "syntaxType": "yellow",
    "syntaxOperator": "teal",
    "syntaxPunctuation": "text",

    "thinkingOff": "surface0",
    "thinkingMinimal": "overlay0",
    "thinkingLow": "blue",
    "thinkingMedium": "teal",
    "thinkingHigh": "mauve",
    "thinkingXhigh": "pink",

    "bashMode": "green"
  },
  "export": {
    "pageBg": "#11111b",
    "cardBg": "#1e1e2e",
    "infoBg": "#313244"
  }
}
