{
  "$schema": "https://raw.githubusercontent.com/dst0/p/main/packages/coding-agent/src/modes/interactive/theme/theme-schema.json",
  "name": "shamrock",
  "symbol": "☘️",
  "vars": {
    "emerald": "#00c853",
    "deepGreen": "#1b5e20",
    "lime": "#76ff03",
    "gold": "#f9a825",
    "brightGold": "#fdd835",
    "sage": "#a5d6a7",
    "text": "#e8f5e9",
    "gray": "#8a9a8a",
    "dimGray": "#5a6a5a",
    "darkGray": "#2a3a2a",
    "selectedBg": "#152a15",
    "userMsgBg": "#101a15",
    "toolPendingBg": "#151e15",
    "toolSuccessBg": "#152015",
    "toolErrorBg": "#301515",
    "customMsgBg": "#151a25"
  },
  "colors": {
    "accent": "emerald",
    "border": "deepGreen",
    "borderAccent": "gold",
    "borderMuted": "darkGray",
    "success": "emerald",
    "error": "#c62828",
    "warning": "gold",
    "muted": "gray",
    "dim": "dimGray",
    "text": "text",
    "thinkingText": "gray",

    "selectedBg": "selectedBg",
    "userMessageBg": "userMsgBg",
    "userMessageText": "text",
    "customMessageBg": "customMsgBg",
    "customMessageText": "text",
    "customMessageLabel": "deepGreen",
    "toolPendingBg": "toolPendingBg",
    "toolSuccessBg": "toolSuccessBg",
    "toolErrorBg": "toolErrorBg",
    "toolTitle": "text",
    "toolOutput": "gray",

    "mdHeading": "gold",
    "mdLink": "emerald",
    "mdLinkUrl": "dimGray",
    "mdCode": "lime",
    "mdCodeBlock": "deepGreen",
    "mdCodeBlockBorder": "gray",
    "mdQuote": "gray",
    "mdQuoteBorder": "sage",
    "mdHr": "dimGray",
    "mdListBullet": "gold",

    "toolDiffAdded": "emerald",
    "toolDiffRemoved": "#c62828",
    "toolDiffContext": "gray",

    "syntaxComment": "#3a5a3a",
    "syntaxKeyword": "#1b5e20",
    "syntaxFunction": "#f9a825",
    "syntaxVariable": "#00c853",
    "syntaxString": "#76ff03",
    "syntaxNumber": "#fdd835",
    "syntaxType": "#a5d6a7",
    "syntaxOperator": "#e8f5e9",
    "syntaxPunctuation": "#8a9a8a",

    "thinkingOff": "darkGray",
    "thinkingMinimal": "#5a6a5a",
    "thinkingLow": "#76ff03",
    "thinkingMedium": "#00c853",
    "thinkingHigh": "#f9a825",
    "thinkingXhigh": "#1b5e20",

    "bashMode": "emerald"
  },
  "export": {
    "pageBg": "#080e08",
    "cardBg": "#0e150e",
    "infoBg": "#151a10"
  }
}
