{
  "$schema": "https://raw.githubusercontent.com/dst0/p/main/packages/coding-agent/src/modes/interactive/theme/theme-schema.json",
  "name": "one-dark",
  "vars": {
    "background": "#282c34",
    "foreground": "#abb2bf",
    "selection": "#3e4451",
    "comment": "#5c6370",
    "blue": "#61afef",
    "cyan": "#56b6c2",
    "green": "#98c379",
    "purple": "#c678dd",
    "red": "#e06c75",
    "yellow": "#e5c07b",
    "orange": "#d19a66",
    "toolPendingBg": "#2c313a",
    "toolSuccessBg": "#29352e",
    "toolErrorBg": "#3b2a2e",
    "userMsgBg": "#353b45",
    "customMsgBg": "#372e3d"
  },
  "colors": {
    "accent": "blue",
    "border": "comment",
    "borderAccent": "cyan",
    "borderMuted": "selection",
    "success": "green",
    "error": "red",
    "warning": "yellow",
    "muted": "comment",
    "dim": "#4b5263",
    "text": "foreground",
    "thinkingText": "comment",

    "selectedBg": "selection",
    "userMessageBg": "userMsgBg",
    "userMessageText": "foreground",
    "customMessageBg": "customMsgBg",
    "customMessageText": "foreground",
    "customMessageLabel": "purple",
    "toolPendingBg": "toolPendingBg",
    "toolSuccessBg": "toolSuccessBg",
    "toolErrorBg": "toolErrorBg",
    "toolTitle": "foreground",
    "toolOutput": "comment",

    "mdHeading": "yellow",
    "mdLink": "blue",
    "mdLinkUrl": "comment",
    "mdCode": "cyan",
    "mdCodeBlock": "green",
    "mdCodeBlockBorder": "comment",
    "mdQuote": "comment",
    "mdQuoteBorder": "blue",
    "mdHr": "comment",
    "mdListBullet": "blue",

    "toolDiffAdded": "green",
    "toolDiffRemoved": "red",
    "toolDiffContext": "comment",

    "syntaxComment": "comment",
    "syntaxKeyword": "purple",
    "syntaxFunction": "blue",
    "syntaxVariable": "red",
    "syntaxString": "green",
    "syntaxNumber": "orange",
    "syntaxType": "yellow",
    "syntaxOperator": "cyan",
    "syntaxPunctuation": "foreground",

    "thinkingOff": "selection",
    "thinkingMinimal": "comment",
    "thinkingLow": "blue",
    "thinkingMedium": "cyan",
    "thinkingHigh": "purple",
    "thinkingXhigh": "red",

    "bashMode": "green"
  },
  "export": {
    "pageBg": "#21252b",
    "cardBg": "#282c34",
    "infoBg": "#353b45"
  }
}
