{
  "$schema": "https://raw.githubusercontent.com/dst0/p/main/packages/coding-agent/src/modes/interactive/theme/theme-schema.json",
  "name": "kanagawa",
  "vars": {
    "sumiInk0": "#16161d",
    "sumiInk1": "#1f1f28",
    "sumiInk2": "#2a2a37",
    "sumiInk3": "#363646",
    "sumiInk4": "#54546d",
    "fujiWhite": "#dcd7ba",
    "fujiGray": "#727169",
    "waveBlue1": "#223249",
    "waveBlue2": "#2d4f67",
    "springGreen": "#98bb6c",
    "boatYellow2": "#e6c384",
    "carpYellow": "#e0af68",
    "waveAqua1": "#6a9589",
    "waveAqua2": "#7aa89f",
    "springBlue": "#7e9cd8",
    "oniViolet": "#957fb8",
    "sakuraPink": "#d27e99",
    "peachRed": "#ff5d62",
    "surimiOrange": "#ffa066",
    "toolPendingBg": "#252535",
    "toolSuccessBg": "#26352b",
    "toolErrorBg": "#3d2729",
    "userMsgBg": "#2a2a37",
    "customMsgBg": "#332b3d"
  },
  "colors": {
    "accent": "springBlue",
    "border": "sumiInk4",
    "borderAccent": "waveAqua2",
    "borderMuted": "sumiInk3",
    "success": "springGreen",
    "error": "peachRed",
    "warning": "boatYellow2",
    "muted": "fujiGray",
    "dim": "#54546d",
    "text": "fujiWhite",
    "thinkingText": "fujiGray",

    "selectedBg": "waveBlue2",
    "userMessageBg": "userMsgBg",
    "userMessageText": "fujiWhite",
    "customMessageBg": "customMsgBg",
    "customMessageText": "fujiWhite",
    "customMessageLabel": "oniViolet",
    "toolPendingBg": "toolPendingBg",
    "toolSuccessBg": "toolSuccessBg",
    "toolErrorBg": "toolErrorBg",
    "toolTitle": "fujiWhite",
    "toolOutput": "fujiGray",

    "mdHeading": "boatYellow2",
    "mdLink": "springBlue",
    "mdLinkUrl": "fujiGray",
    "mdCode": "waveAqua2",
    "mdCodeBlock": "springGreen",
    "mdCodeBlockBorder": "sumiInk4",
    "mdQuote": "fujiGray",
    "mdQuoteBorder": "springBlue",
    "mdHr": "sumiInk4",
    "mdListBullet": "springBlue",

    "toolDiffAdded": "springGreen",
    "toolDiffRemoved": "peachRed",
    "toolDiffContext": "fujiGray",

    "syntaxComment": "fujiGray",
    "syntaxKeyword": "oniViolet",
    "syntaxFunction": "springBlue",
    "syntaxVariable": "fujiWhite",
    "syntaxString": "springGreen",
    "syntaxNumber": "sakuraPink",
    "syntaxType": "waveAqua2",
    "syntaxOperator": "boatYellow2",
    "syntaxPunctuation": "fujiWhite",

    "thinkingOff": "sumiInk3",
    "thinkingMinimal": "fujiGray",
    "thinkingLow": "springBlue",
    "thinkingMedium": "waveAqua2",
    "thinkingHigh": "oniViolet",
    "thinkingXhigh": "peachRed",

    "bashMode": "springGreen"
  },
  "export": {
    "pageBg": "#16161d",
    "cardBg": "#1f1f28",
    "infoBg": "#2a2a37"
  }
}
